comparison_axis,minimap_view,ranked_macro_view,interpretation_note
map grouping vs game pace,Minimap clusters describe repeated spatial states such as grouped or spread map formations.,Most common pace style: unknown.,"This comparison is descriptive only: grouped minimap states may co-occur with faster games, but the datasets are not directly aligned at the same match level."
bot-side control vs dragon focus,Clusters with bot-side or river-oriented top features may reflect objective setup patterns.,Most common neutral-focus pattern: dragon_focused (94.0%).,"Bot-side spatial emphasis can be compared qualitatively with dragon-focused macro outcomes, but should not be treated as a direct matched-sample finding."
spread states vs low-objective games,Some minimap clusters may indicate lane-spread or low-grouping states.,Most common objective-focus pattern: objective_light (56.6%).,"Spread states may be consistent with lower objective pressure in some games, but this is a descriptive interpretation rather than a causal conclusion."
state diversity vs game length,Multiple distinct cluster types suggest a range of map-control states during gameplay.,Most common game-length style: standard (48.9%).,"Longer games may allow a broader variety of spatial states, but this comparison remains semi-quantitative because minimap frames and ranked matches are not one-to-one aligned."
cluster summary overview,"Cluster 0: top features suggest emphasis on river_count, mean_x, center_count. | Cluster 1: top features suggest emphasis on base_count, blue_base_count, mean_y. | Cluster 2: top features suggest emphasis on red_side_count, lane_count_bot, bot_lane_count. | Cluster 3: top features suggest emphasis on bot_lane_count, lane_count_bot, mean_y. | Cluster 4: top features suggest emphasis on red_side_count, mean_x, river_count.","Macro summaries aggregate objective focus, pace, neutral-control emphasis, and game length.","Use these two views together as complementary evidence: minimap clusters show how teams occupy space, while ranked macro features describe overall match outcomes and tempo."
